Id,Source,Target,Type,Label,Description,Source_Chunks
108,Рекуррентные нейронные сети,Высокие вычислительные затраты,causes,causes,Обучение рекуррентных нейронных сетей приводит к высоким вычислительным затратам.,30
109,Взрывные градиенты,Рекуррентные нейронные сети (RNN),connected-to,connected-to,"Взрывные градиенты являются одной из проблем, возникающих при обучении рекуррентных нейронных сетей.",31
110,Затухающие градиенты,Рекуррентные нейронные сети (RNN),connected-to,connected-to,"Затухающие градиенты являются одной из проблем, возникающих при обучении рекуррентных нейронных сетей.",31
111,Рекуррентные нейронные сети (RNN),Забывание информации на длинных последовательностях,causes,causes,Рекуррентные нейронные сети подвержены проблеме забывания информации на длинных последовательностях.,31
112,Внимание,Нейронные сети,part-of,part-of,Механизм внимания используется в нейронных сетях.,31
113,Взвешенное суммирование,Контекстный вектор,produces,produces,Взвешенное суммирование данных с учетом весов создает контекстный вектор.,32
114,Внимание,Веса внимания,produces,produces,Механизм внимания вычисляет веса внимания для каждого элемента входных данных.,32
115,Веса внимания,Взвешенное суммирование,used-for,used-for,Веса внимания используются при взвешенном суммировании данных.,32
116,Селективность внимания,Внимание,part-of,part-of,"Селективность является одной из особенностей внимания в мозге, позволяющей выбирать, на чем сосредоточиться.",33
117,Гибкость внимания,Внимание,part-of,part-of,"Гибкость является одной из особенностей внимания в мозге, позволяющей переключаться или распределяться между задачами.",33
118,Префронтальная кора,Внимание,connected-to,connected-to,"Префронтальная кора является частью сложной сети мозга, которая регулирует внимание.",33
119,Теменная кора,Внимание,connected-to,connected-to,"Теменная кора является частью сложной сети мозга, которая регулирует внимание.",33
120,Внимание,Мозг,similar-to,similar-to,"Механизм внимания в нейронных сетях вдохновлен работой мозга, и у них есть общие черты.",34
121,Weights внимания,Внимание,part-of,part-of,Weights внимания являются частью механизма внимания в нейронных сетях.,34
122,Активация нейронных путей,Мозг,part-of,part-of,"Активация нейронных путей является частью работы мозга, аналогичной weights внимания в нейронных сетях.",34
123,Переключение внимания,Мозг,part-of,part-of,"Мозг переключается между словами при чтении, что является примером динамической адаптации внимания к контексту.",34
124,Внимание,Скалярное произведение,used-for,used-for,В нейронных сетях внимание использует скалярное произведение для вычисления весов.,35
125,Нейронные сети,Оптимизация,enables,enables,В нейронных сетях внимание настраивается через оптимизацию на данных.,35
126,Мозг,Внимание,similar-to,similar-to,"В мозге внимание - это сложное взаимодействие нейронов, памяти и восприятия, что является аналогом механизма внимания в нейронных сетях.",35
127,Мозг,Опыт,develops-through,develops-through,Развитие мозга происходит через опыт.,36
128,Мозг,Врожденные механизмы,depends-on,depends-on,Развитие мозга зависит от врожденных механизмов.,36
129,Предиктивное кодирование,Мозг,considers,considers,Гипотеза предиктивного кодирования рассматривает мозг как машину предсказаний.,36
130,Прямое распространение,Предсказание,similar-to,similar-to,Прямое распространение аналогично предсказанию.,36
131,Нейрон,Предсказание,produces,produces,"Нейроны каждого слоя формируют ""ожидания"" (предсказания).",36
132,Нейрон,Weights (Веса),connected-to,connected-to,Связи между нейронами называются весами.,37
133,Предсказание,Ошибка предсказания,causes,causes,"Ошибка предсказания возникает, когда фактический результат отличается от ожидаемого.",37
134,Ошибка предсказания,__MATH_FORMULA_2__,represents,represents,"Ошибка предсказания рассчитывается как разница между реальным значением (y) и предсказанным значением (ŷ), что представлено математической формулой номер 2.",37
135,y,__MATH_FORMULA_2__,part-of,part-of,y (реальное значение) является частью формулы для расчета ошибки предсказания (__MATH_FORMULA_2__).,37
136,ŷ,__MATH_FORMULA_2__,part-of,part-of,ŷ (предсказанное значение) является частью формулы для расчета ошибки предсказания (__MATH_FORMULA_2__).,37
137,Градиенты ошибки,Weights (Веса),used-for,used-for,"Градиенты ошибки вычисляются для каждого веса, чтобы понять, насколько он повлиял на итоговую ошибку.",38
138,Искусственная нейронная сеть,Градиенты ошибки,contains,contains,В искусственных нейронной сети вычисляются градиенты ошибки.,38
139,Предиктивное кодирование,Мозг,connected-to,connected-to,"Предиктивное кодирование рассматривается как механизм, который использует мозг для корректировки внутренней модели мира.",39
140,Сигналы ошибки,Внутренняя модель мира,causes,causes,"Сигналы ошибки, согласно гипотезе предиктивного кодирования, передаются назад, чтобы скорректировать внутреннюю модель мира.",39
141,Weights,Ошибка предсказания,causes,causes,Weights корректируются пропорционально их вкладу в ошибку предсказания.,39
142,Пластичность синапсов,Мозг,same-as,same-as,Пластичность синапсов в мозге сравнивается с процессом корректировки весов в нейронной сети.,39
143,Градиент функции потерь,Weights,connected-to,connected-to,"Градиент функции потерь относительно weights показывает, как вес влияет на ошибку.",39
